ID,quant,match,context,title,clauses,url,standalone,processed,precedingmodifier
12536,everything,everything I said couldn't have been more wrong," Really? Mr.  Oh yeah, because, you know, his - as a reader, it's his - his journalism is something that's - you know, as a reader I'm just more sort of taken with, and his novels are, particularly ""Two Mrs. Grenvilles"" and some afterwards, I remember reading ""People Like Us,"" and Tom Wolfe's book had just come out, and I said, Dad, oh my God, this is in the same terrain, and they're going to, you know, criticize you, and it's going to be - and you're taking on these people, and it's - everything I said couldn't have been more wrong. It was his biggest seller, and I worried him about nothing.",Griffin Dunne On The Life And Work Of His Father,423,https://www.npr.org/transcripts/121458755,NONE,No,
12537,Every experience,Every experience isn't like that,"Mr.  And it isn't. Every experience isn't like that. It was a - it was a really beautiful, beautiful time.",Jason Segel Explains The Mysteries Of Guydom,831,https://www.npr.org/transcripts/113833274,NONE,No,
12538,everyone,everyone else just wasn't paying attention that week,"Well, I think I started doing her in, like, 2004 or 2005, I tried to do her a couple times. And certainly it probably was just I was - it was a process of, you know, sometimes when you're doing an impression on that show, it's just kind of because you maybe have a take on that person, or you sound or look like that person. I think that I probably got the job because everyone else just wasn't paying attention that week, because I certainly don't sound like her. We're similar but -in the way we look, but - and I didn't really have a take on her.",For Amy Poehler Comedy Is A Walk In The Park,200,https://www.npr.org/transcripts/112961878,NONE,No,
12540,Everybody,Everybody couldn't believe how it turned out,"You know, they're the on course announcers for us. Roger was following, talking with Tiger and Mark was talking with me so, following me. So it was just an emotional Everybody couldn't believe how it turned out, because in all it was over after 9, after 10 holes everyone thought. Except for me.",The Journeyman Golfer Who Took On Tiger,324,https://www.npr.org/transcripts/104604798,NONE,No,
12544,Everybody,Everybody here Can't stop laughing,"Indeed, charm and a knack for memorable melodies is what lends Fol Chen an energy too many self-consciously hip bands lack.    Everybody here thinks I'm an idiot. Everybody here Can't stop laughing. How can that be true If I'm in love with you?",Elusive Fol Chen Offers Dark Whimsical Debut,70,https://www.npr.org/transcripts/100569984,NONE,No,
