ID,quant,match,context,title,clauses,url,standalone,processed,precedingmodifier
12458,everybody,everybody is not really going to get out of the car and sing and dance,"And announce that these scenes are not necessarily real, the musical scenes. They're breaking from reality. They're a wishful reality because everybody is not really going to get out of the car and sing and dance. . Yeah, alas.",La La Land Director Aimed To Make A Film Even Musical Skeptics Would Love,408,https://www.npr.org/transcripts/513235368,NONE,No,
12459,everything,everything I was doing wasn't good enough,"Dad would scold me about rushing through homework. And when that was done, he'd scold me for rushing through prayers. In silent protest, I'd sit on my prayer rug and daydream, trying to think of anything but dad in my head telling me that everything I was doing wasn't good enough. When dad realized I was lying about finishing my prayers, I braced myself for a stern lecture.",After Trumps Election A Nonpracticing Muslim Returns To Prayer,63,https://www.npr.org/transcripts/510346895,NONE,No,
12461,everybody,everybody doesn't experience it,"So it's - anybody who works in hospice will tell you - anybody - that it's really common for people who are dying to see their mothers. It's not a necessary step. It's not - everybody doesn't experience it, but it happens a lot.  To see mothers who have - who are dead? Already died, yeah.",Hospice Chaplain Reflects On Life Death And The Strength Of The Human Soul,540,https://www.npr.org/transcripts/499762656,NONE,No,
12463,everyone,everyone else wasn't fazed,"And I think the people - no one around me was concerned. And so even though I didn't have a context for it yet - I hadn't lived in the city for 10 years - I could see that everyone else wasn't fazed. So I thought, oh, this must be normal.",Former Restaurant Worker Serves Up IndustryInspired Fiction In Sweetbitter,453,https://www.npr.org/transcripts/482296526,NONE,No,
12464,every promise,every promise don't work out that way,"Our rock critic, Ken Tucker, has some thoughts about ""Lemonade's"" music and the interpretations of it.BEYONCE,   We built sand castles that washed away. I made you cry when I walked away. And although I promised that I could stay, baby, every promise don't work out that way. Oh, baby, every promise don't work out that way. I made you cry when I walked away. And although I promised that I could stay, baby, every promise don't work out that way. Oh, baby, every promise don't work out that way.  The first thing to be said about ""Lemonade"" is that it's a very impressive pop album, and I'm using pop in its broadest sense.",Beyoncé Is At The Height Of Her Powers In Lemonade,64,https://www.npr.org/transcripts/476877016,NONE,No,
12468,every man,every man I was working with definitely didn't worry about being difficult or spoiled,"I didn't want to keep fighting for millions of dollars that, frankly, due to franchises, I don't need, parentheses, . Then you wrote -  but if I'm honest with myself, I would be lying if I didn't say there was an element of wanting to be liked that influenced my decision to close the deal without a real fight. I didn't want to see seem difficult or spoiled. And then you say you realized from the hack that, quote, ""every man I was working with definitely didn't worry about being difficult or spoiled. ""So, how did you decide to say that in public? I was aware of gender inequality, of the, you know, 21 percent general pay gap between men and women.",Jennifer Lawrence Looks Back On A CareerChanging YesOrNo Question,730,https://www.npr.org/transcripts/460272795,NONE,No,
12471,everything,everything's not OK,"Probably - I was scared. And I just, you know, I picked Nicole up and put her in my arms, and I said everything's going to be OK. And I knew in my mind, everything's not OK. My impression from the book, Wayne, was that at first you were just very understandably upset at this confusion that you thought your daughter was having about who she was because she was born with male anatomy.",Becoming Nicole Recounts One Familys Acceptance Of A Transgender Child,481,https://www.npr.org/transcripts/449937765,NONE,No,
12473,everything,everything else I'm asking isn't,"My guest is Jonathan Franzen, the author of the best-sellers, ""The Corrections"" and ""Freedom."" His new novel is titled, ""Purity."" Having children is part of the story in the book knowing or not knowing who your parents are, the decision to have or not have a child, and this might be too personal - not like everything else I'm asking isn't - but I know you don't have children, and I was wondering if you wouldn't mind if I asked if that was intentional or not.",Jonathan Franzen On Writing Its An Escape From Everything,483,https://www.npr.org/transcripts/436442184,NONE,No,
12474,everyone,everyone else wasn't,"It's not quite as clear today in the 1980s who is exactly criminal and who isn't. We've had occasions of public officials who been supposed or sworn to uphold the law who have, in fact, broken it. And all that kind of thing just leeches it away, gives you almost a wish for the good old days when a crook was a crook and everyone else wasn't.  Why did you choose Dutch Schultz as the gangster that the main character in your novel apprentices himself to?",Fresh Air Remembers Billy Bathgate Author E L Doctorow,216,https://www.npr.org/transcripts/425892294,NONE,No,
12478,everything,everything is not awesome,"One of Wilmore's approaches is the same trick used by Stewart, Colbert and Oliver - pull clips from local and national TV news shows and comment on them sarcastically. Last night, Wilmore did it to play against audience expectations, starting by saying that a particular movie was robbed by not being nominated for best picture, and noting that its subject was as resonant now as when he was a child, Wilmore had the entire audience thinking he was talking about the movie ""Selma,"" about Martin Luther King Jr, until he cut to a clip of ""The Lego Movie."" And as Wilmore continued and showed a TV news clip, he made it clear that he was going to deliver his opinion and that it wouldn't always be protectable. No, everything is not awesome. How did ""The Lego Movie"" not get nominated for best picture? God, this was shocking.",The Nightly Show With Larry Wilmore Debuts In Slot Vacated By Stephen Colbert,90,https://www.npr.org/transcripts/378588592,NONE,No,
12479,every little blog post,every little blog post wasn't such a big deal for us,"about - oh, they're in Washington Square Park and it's about them selling - or, buying weed. And it's like, that's something that relates to like, our viewership. And it was just very slow and steady, but every little blog post wasn't such a big deal for us because it got the word out. And I have to say because we came out of this amazing community, like, Facebook built our show.",In Broad City Two Women Make Comedy From The Muck Of New York Living,322,https://www.npr.org/transcripts/377061731,NONE,No,
12480,everyone,everyone will not be pleased,"But it's still - I always think that historical films still have a responsibility to history. And if you could just address a little bit the kind of landmines involved in doing, you know, any historical film.  With any historical film, everyone will not be pleased. And so for me, it was really about bringing in every - every character that you - every named character in ""Selma"" is a real person.",The Sounds Space And Spirit Of Selma A Directors Take,570,https://www.npr.org/transcripts/375756377,NONE,No,
12484,everybody,everybody didn't share the goal,"Right. The book is about one chapter in a larger narrative, and that narrative includes so many people who worked so hard on this issue, when the going was far tougher, you know, than it is today, and I have nothing but respect for those people, people like Evan Wolfson, people like - also like Paul Smith. But what changed in this moment was the strategy, to the extent that a group of people came together in what was a really, you know, dark moment in the gay rights movement, a moment when California of all places enshrined a ban into its constitution and said state-court-by-state-court and ballot-box-by-ballot-box strategy isn't working, or they didn't think it was working, and they wanted to do something quite radical, really quite radical, which is bring this cause to the Supreme Court, and it was very controversial, really controversial because, you know, the worry was - it wasn't that everybody didn't share the goal and want a nationwide, 50-state, you know, ruling that gay and lesbian couples had a constitutional right to marry, but the worry was that the country wasn't ready, that the court wasn't ready and that they would lose. And a lot of these activists who were very opposed to this litigation, and I think some of - that's what you're seeing reflected a little bit here - a lot of the activists remembered, you know, Bowers v. Hardwick, which was a case brought by the ACLU, and it was a case challenging sodomy laws, and the court wound up upholding sodomy laws, and it took years and years for the court to reverse itself, and it was a terrible setback for the gay community.",Forcing The Spring Tells One Chapter In Story Of Marriage Equality,399,https://www.npr.org/transcripts/305850912,NONE,No,
12486,everything,everything does not turn out perfectly,"The investigation takes him from chic nightclubs into the sinister underbelly of fashion mad Milan where pretty young women exist to have their bodies stripped, sold, and carved up by thugs. Along the way, Duca befriends a smart, attractive young woman Livia who has her own reasons for bringing the bad guys down. Suffice it to say that everything does not turn out perfectly. Through it all, Duca remains a terrific, brooding, conflicted character - an accidental detective.",Exploring Lifes Incurable Soiledness With The Father Of Italian Noir,50,https://www.npr.org/transcripts/303717907,NONE,No,
12487,every parent,every parent with their screaming child and uncomfortable child isn't willing to bite the bullet,"So at every age they're using fewer antibiotics. And Swedes are not that biologically different from us, but the practice of medicine is different, and culturally it's different. And here in the U.S. we know that we're overusing antibiotics, but every parent with their screaming child and uncomfortable child isn't willing to bite the bullet because they think that maybe the antibiotics could help them. But if...",Modern Medicine May Not Be Doing Your Microbiome Any Favors,466,https://www.npr.org/transcripts/302899093,NONE,No,
12490,everyone,everyone doesn't have a part of it,"Football was the one game that I thought was the most inclusive. It was the truest team game. I mean nothing happens on a football field if everyone doesn't have a part of it. I mean, you can have the greatest quarterback in the league, but if the guys up front don't block, and the guys don't run the pattern or catch the ball, then that quarterback isn't going to win a game.",Sports Writer Ray Didinger On The Myth Of The Dumb Football Player,507,https://www.npr.org/transcripts/268884853,NONE,No,
12491,everybody,everybody can't afford to go buy bottled water all the time to bathe their kids in,"When you go to restaurants, you heard people asking, you know, are you using bottled water or are you using tap water, and restaurants are putting out press releases and they have signs outside saying, you know, we're using only bottled water. And, you know, there was an interesting thing that happened on Monday this week. We'd been getting shipments of water through FEMA that have been handed out by the state and local authorities to people, because, of course, you know, everybody can't afford to go buy bottled water all the time to bathe their kids in. Well, the last of that water was handed out on Monday at our county courthouse here in Kanawha County in Charleston, and there's a little bit of convoluted information.",How Industrial Chemical Regulation Failed West Virginia,314,https://www.npr.org/transcripts/268201454,NONE,No,
12493,everyone,everyone was always not well,"It was just, it was like walking into the Mayo Clinic with phlegm, basically. Basically it was just the Mayo Clinic with phlegm. That was them. And it was always - everyone was always not well. And I think a way to combat my sort of fear of what would eventually happen to me, because you understand, as I say in the book very early, that nobody gets out of this alive, that I would imitate them and, you know, make jokes about them.",Billy Crystal Finds Fun In Growing Old But Still Cant Find His Keys,640,https://www.npr.org/transcripts/247502247,NONE,No,
12496,everyone,everyone didn't have those same opportunities,"I think doing my training at Temple as a surgical intern and a surgical resident, educated me to what was going on just four miles from City Hall. I felt very fortunate about the opportunities that I had. And, you know, it just kind of didn't seem fair, believe it or not, that everyone didn't have those same opportunities. And, you know, there was a little war going on in North Philadelphia.",Program Fights Gun Violence Bravado With Story Of Suffering,573,https://www.npr.org/transcripts/218582217,NONE,No,
12497,everything,everything that glitters isn't golden,"The first time with The Roots. This also adds to my kind of the adage of never meet your heroes, and never get excited about anything. So if you want to know why like, you know, playing with Obama was just like another day at the office, is because, you know, when I did ""Soul Train,"" I'll probably say that was probably one of the experiences that like told me like oh, OK, everything that glitters isn't golden. The grass is always greener on the other side. Yeah. Well... And even then they told me to sort of like, you know, keep in mind that everyone doesn't have the ""Soul Train"" IQ I do, so it's not necessarily... It's not necessary to write a chapter on, you know, the stage dimensions throughout the years or that type of thing. My guest is Questlove, Ahmir Thompson, the drummer and co-founder of the hip-hop band The Roots, which is the house band for ""Late Night with Jimmy Fallon.""",Questloves Roots A Meta Memoir Of A Lifetime In Music,632,https://www.npr.org/transcripts/215829351,NONE,No,
12498,everyone,"everyone doesn't have the ""Soul Train"" IQ I do","The first time with The Roots. This also adds to my kind of the adage of never meet your heroes, and never get excited about anything. So if you want to know why like, you know, playing with Obama was just like another day at the office, is because, you know, when I did ""Soul Train,"" I'll probably say that was probably one of the experiences that like told me like oh, OK, everything that glitters isn't golden. The grass is always greener on the other side. Yeah. Well... And even then they told me to sort of like, you know, keep in mind that everyone doesn't have the ""Soul Train"" IQ I do, so it's not necessarily... It's not necessary to write a chapter on, you know, the stage dimensions throughout the years or that type of thing. My guest is Questlove, Ahmir Thompson, the drummer and co-founder of the hip-hop band The Roots, which is the house band for ""Late Night with Jimmy Fallon.""",Questloves Roots A Meta Memoir Of A Lifetime In Music,632,https://www.npr.org/transcripts/215829351,NONE,No,
12502,everybody,everybody doesn't think this is hilarious,"OK. Sorry. Give the - and I said, everybody doesn't think this is hilarious? And so, you know, you're right, in many ways that was a very conservative show.",Arrested No More Hurwitz On Why The Bluths Are Back,682,https://www.npr.org/transcripts/187343353,NONE,No,
12505,everything,everything's not perfect,And this level of stress that we'd always felt was there diminished. It was like draining a pool. And everything's not perfect. He's still emotionally vulnerable. And everything's not perfect. He's still emotionally vulnerable. Every day isn't great. But he's got friends he hangs out with.,An Oddly Normal Outcome For A Singular Child,428,https://www.npr.org/transcripts/164201946,NONE,No,
12506,Every day,Every day isn't great,And this level of stress that we'd always felt was there diminished. It was like draining a pool. And everything's not perfect. He's still emotionally vulnerable. And everything's not perfect. He's still emotionally vulnerable. Every day isn't great. But he's got friends he hangs out with.,An Oddly Normal Outcome For A Singular Child,428,https://www.npr.org/transcripts/164201946,NONE,No,
12509,everything,everything that's said about you is not about you,"I think I would be - I'd say - it would just make me - I'd be angry all the time. And he - he laughed at me. He said that what you've got to realize - and you would realize instantly when you're in the job, you learn this on the campaign, he said - is that virtually everything that's said about you is not about you. It's about the person who's doing the speaking.",In Meetings On The Court To Discover Obamas Way,451,https://www.npr.org/transcripts/161003362,NONE,No,
12510,everyone,everyone doesn't agree with that,There's the notion of the GM plant in Janesville. I think that there's a defense of the Janesville. I know everyone doesn't agree with that. He never said it closed under Obama.,Journalist Evaluates Obama Romney Economic Plans,373,https://www.npr.org/transcripts/160607524,NONE,No,
12512,every one of the garden plants,"every one of the garden plants that I'm about to buy to stick in my own garden are in fact not local, either","The Columbian exchange sort of underlies them all. I love the moment when you're describing being at a local nursery, and you're about to criticize them for not having more local plants when you realize - well, tell us what you realized. I realized that every one of the garden plants that I'm about to buy to stick in my own garden are in fact not local, either, and that that there's absolutely nothing in my garden that originated within 1,000 miles of my house. And I feel sort of foolish that here I am, supposedly this, you know, hip, locally aware guy, and what I'm doing is planting this enormous bed of exotic species.",In 1493 Uncovering The World Columbus Discovered,349,https://www.npr.org/transcripts/157421918,NONE,No,
12513,everybody,everybody doesn't want to direct,"Why did you want to direct it? Well, it's - directing is the best job going. I don't really understand why everybody doesn't want to direct. It's an absolutely fascinating combination of skills required and puzzles set on every possible level, emotional and practical and technical.",Hugh Lauries House No Pain No Gain,491,https://www.npr.org/transcripts/151354373,NONE,No,
12514,everybody,everybody wasn't in psychoanalysis or some kind of therapy,"When you realized what it was, did you... Mm-hmm. ...comprehend it? And I ask this because I think it's fair to say that a lot of people of your generation didn't grow up, you know, reading Freud and studying psychology, and it being, you know, everybody wasn't in psychoanalysis or some kind of therapy. Things have really changed in terms of dealing with psychological issues, and certainly with depression; our understanding of the biochemistry of depression has changed enormously.",Fresh Air Remembers Mike Wallace Of 60 Minutes,137,https://www.npr.org/transcripts/150282652,NONE,No,
12515,everything,everything's not great,"The Flight of the Concords themselves, it's a very Muppety kind of vibe: It's two wide-eyed innocents making their way through a tough New York. And so he knew what to do with that number, right from the start. And in our initial meeting with James - I'd been friends with James for a few years - but in our initial meeting on this movie, he said the movie should open with a song that's about how everything's great, but everything's not great. You know? So - but everything is kind of great in that opening.",Making The Muppets Movie Was Dream Come True,341,https://www.npr.org/transcripts/149078780,NONE,No,
12517,everybody,"everybody involved in the discussion, from the American military leaders to the Iraqi military leaders, did not think it was a good idea that all the troops leave","Yeah, the interesting thing about the fact that the troops are leaving - and, you know, I've been there this year since March, and I think the expectation on all sides was that they would be able to get a deal where some troops could stay after this year. And that of course didn't happen. And so we have them leaving at a time when just about everybody involved in the discussion, from the American military leaders to the Iraqi military leaders, did not think it was a good idea that all the troops leave, that Iraq is not ready for that. But there was always this issue in the background, which was immunity.",After US Troops Leave What Happens To Iraq,236,https://www.npr.org/transcripts/142707873,NONE,No,
12520,everybody,everybody that I spoke to didn't believe that he actually lived there,"Mr.  Well, I was in Abbottabad, where bin Laden was killed. And you know, pretty much everybody that I spoke to didn't believe that he actually lived there.  Really?",How Bin Ladens Death Has Affected AlQaida,423,https://www.npr.org/transcripts/138783681,NONE,No,
12521,every lie,every lie is not a crime,"Why aren't they named? And why isn't this criminal? And he said every lie is not a crime. And so what he was referring to are the complexities of our laws by which, you know, you have to follow certain different provisions for it to be considered a crime, and in his judgment, these lies were not crimes, and so it was a civil case, which has far lower penalties than a criminal case would have.",Why Prosecutors Dont Go After Wall Street,332,https://www.npr.org/transcripts/137789065,NONE,No,
12523,everything,everything ain't looking right,"Yes, I'm living on daydreams. Gon' buy me something I can't afford, uh huh. When the price ain't right and everything ain't looking right, but you still want it all, uh huh. This line is long but still I ponder.",Raphael Saadiq Paying Homage To Souls Past And Future,102,https://www.npr.org/transcripts/136363143,NONE,No,
12524,everything,everything can't be perfect,"But that seems to be, at least during this period of my vulnerability. And it's very funny because - I have to tell you though, my general health has always been so good, and my life has always been so fortunate, that even when this has - had, real, you know, really made my life miserable for periods of time, I still feel like a very, very lucky guy. I look around me and I think, I don't know anybody who doesn't have to solve some kinds of problems and deal with, you know, everything can't be perfect. There has to be - human beings go through things.",James Levine The Man Behind The Mets Baton,526,https://www.npr.org/transcripts/135962451,NONE,No,
12525,everything,everything isn't meant to be okay,"And can you hear the sound of hysteria? The subliminal mind  America. Welcome to a new kind of tension all across the alien nation, where everything isn't meant to be okay. Television dreams of tomorrow...  Unidentified People:  Don't want to be an American idiot, one nation controlled by the media. Don't want to be an American idiot, one nation controlled by the media  calling out to idiot America. Welcome to a new kind of tension all across the alien nation, where everything isn't meant to be okay... TERRY GROSS host: Billie Joe Armstrong, welcome to FRESH AIR.",Green Days Billie Joe Armstrong Takes Broadway,470,https://www.npr.org/transcripts/132908093,NONE,No,
12527,everybody,everybody else doesn't even know it exists,"We're looking back on the year in television with our TV critic, David Bianculli, who's brought his list of the best and worst shows of the year. ""Friday Night Lights"" is on your top 10 list. I think that's one of those shows where the people who watch it absolutely love it, and everybody else doesn't even know it exists. It's funny.",Bianculli Picks The Best And Worst TV Of 2010,625,https://www.npr.org/transcripts/132231853,NONE,No,
12528,everybody,everybody else is not doing nearly that well,"If you are very well-educated and very well-connected, if you're at the right place at the right time, if you are in finance, particularly, or if you are a CEO, if you are a top executive of a big company, you are doing marvelously well. By the first decade of this century, you are really raking in a substantial percentage of national income and also national wealth. But everybody else is not doing nearly that well. We're speaking with Robert Reich.",Reich Blames Economys Woes On Income Disparity,187,https://www.npr.org/transcripts/130189031,NONE,No,
12533,everybody,everybody there didn't know you,"Prisoners would come to you and ask you for your advice. But in the outside world, I imagine there was a time when you felt maybe just a little bit lost. It was such a large world, and everybody there didn't know you, and you didn't have maybe that same kind of power in the outside world. Mr. ",Doing Time And Doing Good In Las Angola Prison,538,https://www.npr.org/transcripts/126217412,NONE,No,
12534,everything,everything wouldnt get matted,"But that meant I couldnt sit down. So for the entire day that we're shooting this, I never sat down. And I had my arms out most of the time so everything wouldnt get matted. Mr. ",Actor Bryan Cranston Breaking With Type,302,https://www.npr.org/transcripts/124888400,NONE,No,
