ID,Title,Quant,Match,Context,Speakers,Date,Link424,The Challenge Of Public Health Messaging Amid An Ever-Changing Virus,every deal with health issues,"But when it comes time to how they deal with health issues, they absolutely do not trust the people that are on radio and TV every day from Washington.","['But they do not trust federal authorities, federal public health scientists, Washington for medical advice.', 'And I use the phrase very clearly medical advice.', 'They might trust them for other things.', 'But when it comes time to how they deal with health issues, they absolutely do not trust the people that are on radio and TV every day from Washington.', ""And that's important to realize if you're going after the people who are not vaccinated, it's a different audience."", '**********']",Ratatouie,"July 31, 2021",https://www.npr.org/2021/07/31/1023243856/the-challenge-of-public-health-messaging-amid-an-ever-changing-virus
425,To Mask Or Not To Mask: A Georgetown University Doctor Weighs In,every talk to people,Every day we talk to people who don't believe in the science.,"['MISHORI: We pull our hair.', 'CHANG: (Laughter).', 'MISHORI: We take a deep breath.', ""Every day we talk to people who don't believe in the science."", ""And it's hard, and it takes a lot of patience, but it takes more than the patience and the education on a one-on-one basis with doctor to patient or nurse to patient."", '**********']",Ratatouie,"July 30, 2021",https://www.npr.org/2021/07/30/1022909570/to-mask-or-not-to-mask-a-georgetown-university-doctor-weighs-in
426,Google Plans To Expand Its Campus — Which Might Become Unsafe As Sea Levels Rise,every leave people more at risk,"But then if we don't maintain it, if we don't continue to pay every single year, it will leave people more at risk than they are now.","[""A.R. Siders is a professor at the University of Delaware's Disaster Research Center."", 'She says while developing in risky areas could help pay for protections, it puts more people at the forefront of disasters.', ""SIDERS: I think we're setting ourselves up for a future where people think they're safe, and we build in reliance on the infrastructure."", ""But then if we don't maintain it, if we don't continue to pay every single year, it will leave people more at risk than they are now."", 'SOMMER:', '**********']",Ratatouie,"July 27, 2021",https://www.npr.org/2021/07/27/1021373017/google-plans-to-expand-its-campus-which-might-become-unsafe-as-sea-levels-rise
427,ESPN's Jay Bilas Weighs In On Student-Athlete Compensation Via NIL Vote,everyone,"So now, college athletes are going to be treated like literally everyone else, and they're not going to be restricted by the NCAA in a cartel fashion.","['BILAS:', 'Well, everyone in America except for a college athlete already owns their name, image and likeness and their right to publicity.', 'And they can do endorsement deals, sell their name, image and likeness, you know, do commercials, whatever they like, except for a college athlete.', ""So now, college athletes are going to be treated like literally everyone else, and they're not going to be restricted by the NCAA in a cartel fashion."", 'CHANG: What about race?', '**********', ""If it's in their interest to offer the players compensation or a contract, they can do that with any other student."", 'You know, any other student is allowed to work for the university and still be enrolled.', 'I mean, to me, all the NCAA should be worried about is, one, running championships and, two, every athlete should be enrolled as a full-time student in good standing.', ""Everything else doesn't need to be dealt with on, you know, the highest level as far as governance."", 'Individual conferences can govern themselves on what they want their standards to be, and individual schools can do that.', '**********']",Ratatouie,"June 29, 2021",https://www.npr.org/2021/06/29/1011415075/espns-jay-bilas-weighs-in-on-student-athlete-compensation-via-nil-vote
428,ESPN's Jay Bilas Weighs In On Student-Athlete Compensation Via NIL Vote,Everything,"Everything else doesn't need to be dealt with on, you know, the highest level as far as governance.","['BILAS:', 'Well, everyone in America except for a college athlete already owns their name, image and likeness and their right to publicity.', 'And they can do endorsement deals, sell their name, image and likeness, you know, do commercials, whatever they like, except for a college athlete.', ""So now, college athletes are going to be treated like literally everyone else, and they're not going to be restricted by the NCAA in a cartel fashion."", 'CHANG: What about race?', '**********', ""If it's in their interest to offer the players compensation or a contract, they can do that with any other student."", 'You know, any other student is allowed to work for the university and still be enrolled.', 'I mean, to me, all the NCAA should be worried about is, one, running championships and, two, every athlete should be enrolled as a full-time student in good standing.', ""Everything else doesn't need to be dealt with on, you know, the highest level as far as governance."", 'Individual conferences can govern themselves on what they want their standards to be, and individual schools can do that.', '**********']",Ratatouie,"June 29, 2021",https://www.npr.org/2021/06/29/1011415075/espns-jay-bilas-weighs-in-on-student-athlete-compensation-via-nil-vote
429,New Books About Trump Presidency Unveil Details (Like How Gravely He Had COVID-19),everyone,"JULIAN ZELIZER: Why did America's political system have room for so much chaos over a four year period, which is like this big puzzle I don't think everyone's totally grappled with?","[""YASMEEN ABUTALEB: Of the more than 180 people we spoke to, there wasn't a single one who defended the collective response."", 'KURTZLEBEN:', 'According to Princeton presidential historian Julian Zelizer, telling the story of the Trump White House means not just recounting news-making moments - the racist statements, the allegations of sexual assault, the impeachments - plural - but making sense of it.', ""JULIAN ZELIZER: Why did America's political system have room for so much chaos over a four year period, which is like this big puzzle I don't think everyone's totally grappled with?"", 'KURTZLEBEN:', '**********']",Ratatouie,"June 29, 2021",https://www.npr.org/2021/06/29/1011415082/new-books-about-trump-presidency-unveil-details-like-how-gravely-he-had-covid-19
430,Vice Mayor Supports Investigation Into How Surfside Handled Condo Damage Warnings,everybody,"And until we've found everybody as best we can, I'm not giving up.","['I am.', 'I have to.', 'I think that - you know, that we have to believe in miracles at this point.', ""And until we've found everybody as best we can, I'm not giving up."", 'Miracles happen.', '**********', 'MCCAMMON:', 'One last thing I want to ask you, Vice Mayor Paul.', ""In the wake of this tragedy, there's a lot of discussion about buildings like this in places like this, particularly at a time when sea level rise and climate change are complicating questions about coastal living."", ""And, of course, as we've discussed, we don't know everything that happened here or why this happened."", 'But are you hearing from other community leaders in coastal areas who may be worried about their own residents after this happened?', '**********']",Ratatouie,"June 27, 2021",https://www.npr.org/2021/06/27/1010760848/vice-mayor-supports-investigation-into-how-surfside-handled-condo-damage-warning
431,Vice Mayor Supports Investigation Into How Surfside Handled Condo Damage Warnings,everything,"And, of course, as we've discussed, we don't know everything that happened here or why this happened.","['I am.', 'I have to.', 'I think that - you know, that we have to believe in miracles at this point.', ""And until we've found everybody as best we can, I'm not giving up."", 'Miracles happen.', '**********', 'MCCAMMON:', 'One last thing I want to ask you, Vice Mayor Paul.', ""In the wake of this tragedy, there's a lot of discussion about buildings like this in places like this, particularly at a time when sea level rise and climate change are complicating questions about coastal living."", ""And, of course, as we've discussed, we don't know everything that happened here or why this happened."", 'But are you hearing from other community leaders in coastal areas who may be worried about their own residents after this happened?', '**********']",Ratatouie,"June 27, 2021",https://www.npr.org/2021/06/27/1010760848/vice-mayor-supports-investigation-into-how-surfside-handled-condo-damage-warning
432,What's In A Genre Name? The Trouble With 'Asian Fantasy',"acquire broadly for, you know, from every population","So why wouldn't you acquire broadly for, you know, from every population?","[""SAXENA: As for Cindy Pon, who's been with the genre from the very beginning..."", ""PON: I'd like to see a future where, you know, white librarians in Iowa won't be like, well, I have the one, you know, Asian kid, and I can't be acquiring these books."", ""And that's the best way to learn and be empathetic, you know, and learn about other people and other cultures."", ""So why wouldn't you acquire broadly for, you know, from every population?"", 'And so that is what I hope for.', '**********']",Ratatouie,"May 30, 2021",https://www.npr.org/2021/05/30/1000466671/whats-in-a-genre-name-the-trouble-with-asian-fantasy
433,Florida Rep. Stephanie Murphy On Debate Over Biden's Infrastructure Plan,everybody,You said you don't want to see the infrastructure bill become like a Christmas tree with presents under it for everybody.,"['I think we need to be careful about putting everything onto a Christmas tree that we think is moving, which is the infrastructure bill.', 'We need to - you know, part of regular order is addressing the issues and creating bills and moving them through Congress in a way that reflects the substance of that issue.', 'MARTIN:', ""You said you don't want to see the infrastructure bill become like a Christmas tree with presents under it for everybody."", ""Is there anything you think is expendable that doesn't belong in it?"", '**********']",Ratatouie,"May 29, 2021",https://www.npr.org/2021/05/29/1001603691/florida-rep-stephanie-murphy-on-debate-over-bidens-infrastructure-plan
434,'Sidelined' Author's Take On Naomi Osaka's Media Boycott,everybody,"It's not a secret that everybody knows this going in, and that if you can't stand the heat, get out of the kitchen.","['MARTIN:', 'So what do you say, though, to the criticism?', ""And there's, of course, a lot of - there's been a lot of response to this who say, look, this is what she signed up for, that this is the life of a professional athlete."", ""It's not a secret that everybody knows this going in, and that if you can't stand the heat, get out of the kitchen."", 'DICARO:', '**********']",Ratatouie,"May 29, 2021",https://www.npr.org/2021/05/29/1001603733/sidelined-authors-take-on-naoimi-osakas-media-boycott
435,New Tiny Computers Could Have A Huge Impact,everybody,"In the future, I don't think that everybody will stop using classical machines and go to quantum.","['Our could count to, I think, four a couple of years ago.', 'So (laughter)...', 'RAJIBUL ISLAM:', ""In the future, I don't think that everybody will stop using classical machines and go to quantum."", ""That's not going to happen."", '**********']",Ratatouie,"April 30, 2021",https://www.npr.org/2021/04/30/992545143/new-tiny-computers-could-have-a-huge-impact
436,State Foster Care Agencies Take Millions Of Dollars Owed To Children In Their Care,every ,"Social Security doesn't report the numbers, but in most and maybe every state, child welfare agencies take those checks - at least $165 million in 2018.","['So we use that money in the same way that a biological parent or guardian would be using it.', 'SHAPIRO:', 'Still, those children who get Social Security checks are the only ones told to, in effect, pay for their own foster care.', ""Social Security doesn't report the numbers, but in most and maybe every state, child welfare agencies take those checks - at least $165 million in 2018."", ""That's from unpublished data collected by the research group Child Trends, and that's just from what was reported by 36 states and the District of Columbia."", '**********']",Ratatouie,"April 22, 2021",https://www.npr.org/2021/04/22/988806806/state-foster-care-agencies-take-millions-of-dollars-owed-to-children-in-their-ca
437,'Long-Haulers' Are Finding Relief After Getting Their COVID-19 Vaccine,everyone,But he doesn't think vaccines will help everyone with long COVID.,"['STEVEN DEEKS:', ""It's all biologically plausible and, importantly, should be easy to test."", 'STONE:', ""But he doesn't think vaccines will help everyone with long COVID."", 'DEEKS: This is many syndromes, we suspect.', '**********']",Ratatouie,"March 30, 2021",https://www.npr.org/2021/03/30/982805660/long-haulers-are-finding-relief-after-getting-their-covid-19-vaccine
438,British Ambassador To The U.S. Explains What A New President Means To The U.K.,everybody,"And if you look at it even not from a moral perspective or a philosophical perspective but from a health perspective, we are not - the world is not going to be safe from COVID until everybody who needs one can have a vaccine.","['PIERCE:', ""There's definitely an attitude of we're all in this together."", 'And Boris Johnson has said as much.', 'And if you look at it even not from a moral perspective or a philosophical perspective but from a health perspective, we are not - the world is not going to be safe from COVID until everybody who needs one can have a vaccine.', ""So we've got to keep going."", '**********']",Ratatouie,"March 30, 2021",https://www.npr.org/2021/03/30/982805677/british-ambassador-to-the-u-s-explains-what-a-new-president-means-to-the-u-k
439,Why Organizing Employee At Alabama Amazon Center Wants A Union,everybody,"But if it don't come in, I feel like, yeah, it'll affect all around and all because everybody realize antiunion state, Bessemer, Ala. - if we could try to make a change, everybody else can, too.","['What do you think?', 'RICHARDSON:', ""I feel like Amazons around the world if - I hate to say if on this right here because I have faith that we're going to win."", ""But if it don't come in, I feel like, yeah, it'll affect all around and all because everybody realize antiunion state, Bessemer, Ala. - if we could try to make a change, everybody else can, too."", ""So I feel like everybody watching us, and we're really making a difference and making a change when it comes to everybody sticking together and standing together."", '**********']",Ratatouie,"March 28, 2021",https://www.npr.org/2021/03/28/982120915/why-organizing-employee-at-alabama-amazon-center-wants-a-union
440,NPR Poetry Month Kicks Off With TikTok Poems,everybody,"Well, don't make fun, but we want to be inclusive of everybody, so I'm going to ask to start with the basics for people who don't know.","['Hi. Thank you.', 'Thank you for having me.', 'MARTIN: All right.', ""Well, don't make fun, but we want to be inclusive of everybody, so I'm going to ask to start with the basics for people who don't know."", ""What's TikTok, and how does it work?"", '**********', ""It's a beautiful effort."", 'But I once heard someone say, a space is only as safe as the least safe person in it.', ""And I think that is really a testament to just understanding that, you know, we can't swear a space to have protection."", ""We can't swear a space to be inviting or welcoming, that, you know, everything is only one moment or one situation from being a threat."", ""And I made that comparison with my mind because it's, like - you know, it's a beautiful space to be, but sometimes it can be a very harsh, very destructive place if you get in your head too much."", '**********', 'But I think first, you must feed yourself, give yourself that satisfaction.', ""And when you share it with the world because you're already satisfied with yourself, and you're already satisfied with the work that you've put into it, even if there's a million people who - I mean, there's not going to be a million people who don't like it."", ""This is, of course - but, like, even if there's people who don't really receive it, as long as you have one or two people - it's almost like church."", ""I don't know if everybody have been to church (laughter)."", ""But, like, sometimes when the pastor's done, he'll do - make an appeal and say, if I can just have one."", '**********']",Ratatouie,"March 28, 2021",https://www.npr.org/2021/03/28/982120943/npr-poetry-month-kicks-off-with-tiktok-poems
441,NPR Poetry Month Kicks Off With TikTok Poems,everything,"We can't swear a space to be inviting or welcoming, that, you know, everything is only one moment or one situation from being a threat.","['Hi. Thank you.', 'Thank you for having me.', 'MARTIN: All right.', ""Well, don't make fun, but we want to be inclusive of everybody, so I'm going to ask to start with the basics for people who don't know."", ""What's TikTok, and how does it work?"", '**********', ""It's a beautiful effort."", 'But I once heard someone say, a space is only as safe as the least safe person in it.', ""And I think that is really a testament to just understanding that, you know, we can't swear a space to have protection."", ""We can't swear a space to be inviting or welcoming, that, you know, everything is only one moment or one situation from being a threat."", ""And I made that comparison with my mind because it's, like - you know, it's a beautiful space to be, but sometimes it can be a very harsh, very destructive place if you get in your head too much."", '**********', 'But I think first, you must feed yourself, give yourself that satisfaction.', ""And when you share it with the world because you're already satisfied with yourself, and you're already satisfied with the work that you've put into it, even if there's a million people who - I mean, there's not going to be a million people who don't like it."", ""This is, of course - but, like, even if there's people who don't really receive it, as long as you have one or two people - it's almost like church."", ""I don't know if everybody have been to church (laughter)."", ""But, like, sometimes when the pastor's done, he'll do - make an appeal and say, if I can just have one."", '**********']",Ratatouie,"March 28, 2021",https://www.npr.org/2021/03/28/982120943/npr-poetry-month-kicks-off-with-tiktok-poems
442,NPR Poetry Month Kicks Off With TikTok Poems,everybody,I don't know if everybody have been to church (laughter).,"['Hi. Thank you.', 'Thank you for having me.', 'MARTIN: All right.', ""Well, don't make fun, but we want to be inclusive of everybody, so I'm going to ask to start with the basics for people who don't know."", ""What's TikTok, and how does it work?"", '**********', ""It's a beautiful effort."", 'But I once heard someone say, a space is only as safe as the least safe person in it.', ""And I think that is really a testament to just understanding that, you know, we can't swear a space to have protection."", ""We can't swear a space to be inviting or welcoming, that, you know, everything is only one moment or one situation from being a threat."", ""And I made that comparison with my mind because it's, like - you know, it's a beautiful space to be, but sometimes it can be a very harsh, very destructive place if you get in your head too much."", '**********', 'But I think first, you must feed yourself, give yourself that satisfaction.', ""And when you share it with the world because you're already satisfied with yourself, and you're already satisfied with the work that you've put into it, even if there's a million people who - I mean, there's not going to be a million people who don't like it."", ""This is, of course - but, like, even if there's people who don't really receive it, as long as you have one or two people - it's almost like church."", ""I don't know if everybody have been to church (laughter)."", ""But, like, sometimes when the pastor's done, he'll do - make an appeal and say, if I can just have one."", '**********']",Ratatouie,"March 28, 2021",https://www.npr.org/2021/03/28/982120943/npr-poetry-month-kicks-off-with-tiktok-poems
443,Why Nearly All Mass Shooters Are Men,everywhere,"I'm not seeing the perpetrator's name and face everywhere, which we know is what contributes to the social contagion.","['PETERSON: I am.', 'I would say in particular, the media coverage seems to have shifted.', ""So these crimes, I'm not seeing as much of the perpetrator in the news cycle."", ""I'm not seeing the perpetrator's name and face everywhere, which we know is what contributes to the social contagion."", 'I think we are having these conversations about gun policies that we could put in place, like red flag laws, waiting periods that might have prevented this specific type of shooting.', '**********']",Ratatouie,"March 27, 2021",https://www.npr.org/2021/03/27/981803154/why-nearly-all-mass-shooters-are-men
444,Ithaca Mayor's Police Reform Plan,every tools in the toolkit,You need more tools in the toolkit 'cause you can't just call us for every problem and then get mad when every problem isn't solved the way you want it to be.,"[""And it really wasn't until the end, the last couple of weeks of this process, where we looked at all of our data and it became clear as day."", ""The police officers themselves are saying, look, we're too stretched."", ""You're asking us to do too much."", ""You need more tools in the toolkit 'cause you can't just call us for every problem and then get mad when every problem isn't solved the way you want it to be."", ""And the community was saying, we don't want public safety to go away."", '**********', 'MARTIN:', 'The proposal has its critics.', 'I mean, the Ithaca police chief called the draft radical.', 'The president of the Ithaca Police Benevolent Association, the PBA, the union said he was deeply concerned by the proposal.', ""The Ithaca police chief's statement said that he agrees that police shouldn't respond to every crisis."", '**********']",Ratatouie,"February 27, 2021",https://www.npr.org/2021/02/27/972145001/ithaca-mayors-police-reform-plan
445,Ithaca Mayor's Police Reform Plan,respond to every crisis,The Ithaca police chief's statement said that he agrees that police shouldn't respond to every crisis.,"[""And it really wasn't until the end, the last couple of weeks of this process, where we looked at all of our data and it became clear as day."", ""The police officers themselves are saying, look, we're too stretched."", ""You're asking us to do too much."", ""You need more tools in the toolkit 'cause you can't just call us for every problem and then get mad when every problem isn't solved the way you want it to be."", ""And the community was saying, we don't want public safety to go away."", '**********', 'MARTIN:', 'The proposal has its critics.', 'I mean, the Ithaca police chief called the draft radical.', 'The president of the Ithaca Police Benevolent Association, the PBA, the union said he was deeply concerned by the proposal.', ""The Ithaca police chief's statement said that he agrees that police shouldn't respond to every crisis."", '**********']",Ratatouie,"February 27, 2021",https://www.npr.org/2021/02/27/972145001/ithaca-mayors-police-reform-plan
446,"Jason Holland, 47: Maroon 5's 'Memories'",everything,"MAROON 5: (Singing) When I did not know no pain, when I believed in forever, everything would stay the same.","['BOWERS: Jason and I are both fans of the Cincinnati Bengals, and we met on a - originally had met on a message board about 17 years ago.', 'And then that just kind of became a friendship that started online.', ""Then every year, when I'd go out to visit my family, I'd make sure to visit Jason."", '(SOUNDBITE OF SONG, ""MEMORIES"")', 'MAROON 5: (Singing) When I did not know no pain, when I believed in forever, everything would stay the same.', '**********']",Ratatouie,"Updated June 15, 2021",https://www.npr.org/sections/songs-of-remembrance/2021/02/27/969563886/jason-holland-47-maroon-5s-memories
447,FDA Considers Johnson & Johnson COVID-19 Vaccine For Emergency Use Authorization,everyone,"And so some of the questions that they had for the sponsor, Janssen, related to whether or not this vaccine was going to work in everyone.","['They listened to presentations from the company.', 'They listened to presentations from the Food and Drug Administration.', 'They listened to presentations from the CDC about how vaccines that have already been rolled out are working and whether there are any side effects that have been detected.', 'And so some of the questions that they had for the sponsor, Janssen, related to whether or not this vaccine was going to work in everyone.', 'But in the end, they were convinced that it would work well enough in enough people.', '**********']",Ratatouie,"February 26, 2021",https://www.npr.org/2021/02/26/971910714/fda-considers-johnson-johnson-covid-19-vaccine-for-emergency-use-authorization
