ID,Title,Quant,Match,Context,Speakers,Date,Link
400,How evictions impact tenants far beyond scrambling to find housing,everything,But the idea of selling or donating everything they own doesn't feel possible.,"[""So I'll keep my fingers crossed because my whole intentions was I was getting too tired for this"", ""and I'm, like, fighting a losing battle type thing, trying to get an apartment, that I actually was thinking about just go get some boxes, put all my stuff in storage and was going to just leave."", ""KIM: Putting her stuff in storage will cost her anything from 100 to $300 a month - money she doesn't have."", ""But the idea of selling or donating everything they own doesn't feel possible."", ""The clothes, television, photographs - it's all they have."", '**********']",Ratatouie,"December 30, 2021",https://www.npr.org/2021/12/30/1069273127/how-evictions-impact-tenants-far-beyond-scrambling-to-find-housing
401,Did the VA secretary come through on his promise to house hundreds of veterans in LA?,everyone,"McDonough declared victory last month on the first promise to house everyone from the Veterans Row encampment, except housing doesn't necessarily mean a home.","[""First, we're going to get the vets currently living on Veterans Row into housing by November."", ""Second, we're going to get an additional 500 homeless vets in Los Angeles into housing by the end of this year."", 'SCOTT:', ""McDonough declared victory last month on the first promise to house everyone from the Veterans Row encampment, except housing doesn't necessarily mean a home."", ""Can you describe what we're looking at?"", '**********']",Ratatouie,"December 30, 2021",https://www.npr.org/2021/12/30/1069273148/did-the-va-secretary-come-through-on-his-promise-to-house-hundreds-of-veterans-i
402,CDC director on new isolation rules,everybody,I think that we are not adequately capturing all of the positive antigen tests and not everybody who tests by antigen.,"['So this confluence of travel and the surge has really led to - the omicron surge has led to a higher demand of testing, and I will add, not just even in this country, but a testing shortage really around the world.', ""SHAPIRO: Given the shortage in the U.S., do you think that the official number we're seeing right now of an average of 200,000 new cases a day might actually be lower than the reality?"", 'WALENSKY:', 'I think that we are not adequately capturing all of the positive antigen tests and not everybody who tests by antigen.', 'So this is probably an undercount of where we are, yes.', '**********']",Ratatouie,"December 28, 2021",https://www.npr.org/2021/12/28/1068587852/cdc-director-on-new-isolation-rules
403,"5 years later, researchers assess how children exposed to Zika are developing",everything,"MARTINEZ: Even now, they don't know everything about Zika, so they still investigate.","['Mulkey is following a group of children affected by COVID-19, and she hopes she can do long-term research with them as well.', 'For his part, Yariel will keep going in for assessments for several more years.', ""That's OK with him and his mom, Yaritza."", ""MARTINEZ: Even now, they don't know everything about Zika, so they still investigate."", 'SIMMONS-DUFFIN:', '**********']",Ratatouie,"December 27, 2021",https://www.npr.org/sections/health-shots/2021/12/27/1062696181/5-years-later-researchers-assess-how-children-exposed-to-zika-are-developing
404,Why Americans buy so much stuff: A short history,everybody,"But we also should remember that not everybody can consume equally, that there's a lot of inequality that has been built into this what I call the consumers' republic, where there's a promise that democracy and equality will be delivered through mass consumption.","['Well, that is a huge dilemma.', 'I think that many people would like to imagine a United States that is less materialistic and less consumed with consuming.', 'And yet we have the problem of, what will fuel this economy?', ""But we also should remember that not everybody can consume equally, that there's a lot of inequality that has been built into this what I call the consumers' republic, where there's a promise that democracy and equality will be delivered through mass consumption."", 'KELLY:', '**********']",Ratatouie,"Updated December 1, 2021",https://www.npr.org/2021/11/29/1059861668/why-americans-buy-so-much-stuff
405,Iran expected to drive hard bargain in nuclear talks,everyone,"But I don't think it's a really viable Band-Aid over a longer-term period because it would, A, force international states to acknowledge that the JCPOA is formally dead, and, B, would require everyone to invest in new negotiations.","['Recently, Washington floated the idea of an interim agreement, something less than a full restoration of the 2015 deal known as the JCPOA.', ""Vakil says that strikes her as kind of a Band-Aid to at least ensure that Iran doesn't gain the capacity to acquire a nuclear weapon."", 'VAKIL:', ""But I don't think it's a really viable Band-Aid over a longer-term period because it would, A, force international states to acknowledge that the JCPOA is formally dead, and, B, would require everyone to invest in new negotiations."", 'And it seems hard to imagine that everyone has the energy to do that right now.', '**********']",Ratatouie,"November 28, 2021",https://www.npr.org/2021/11/28/1059649445/iran-expected-to-drive-hard-bargain-in-nuclear-talks
406,"For wellness community, social media often a conduit for misinformation",everything,So I don't have an answer for everything getting better right away.,"['Well, as we see the continued bifurcation of media in so many different directions, a lot of these people - they might have been kicked off of YouTube or Instagram.', ""But now they're on Telegram or Gab, and they have their email lists in the hundreds of thousands."", 'They are creating their own media sources.', ""So I don't have an answer for everything getting better right away."", ""My bigger fear is that it's going to break off, and you're going to see more - what are called sovereign communities."", '**********']",Ratatouie,"November 27, 2021",https://www.npr.org/2021/11/27/1059539516/for-wellness-community-social-media-often-a-conduit-for-misinformation
407,What Peng Shuai's disappearance says about Beijing's grip on power,happening every day in China,"But, you know, we should not forget that this is happening every day in China, and there are human rights abuses happening in China that we can't overlook.","[""So that's why I compared it to Gabby Petito."", 'You know, she captured the American imagination.', 'You mentioned she was white and blond and, you know, she was on this van life adventure, right?', 'And it captured the American imagination, and this has captured the American imagination.', ""But, you know, we should not forget that this is happening every day in China, and there are human rights abuses happening in China that we can't overlook."", '**********']",Ratatouie,"November 27, 2021",https://www.npr.org/2021/11/27/1059539557/what-peng-shuais-disappearance-says-about-beijings-grip-on-power
408,How to find your next favorite read with NPR's Books We Love,every worked on it,"She worked on it every year, and it's kind of in the spirit of Petra that we don't do best.","['Petra would always say that there is no best book.', 'There are great books for each reader, and whatever you like to read is what NPR should be helping you find.', ""So she was really involved in this year's Books We Love."", ""She worked on it every year, and it's kind of in the spirit of Petra that we don't do best."", 'We do the greatest books for you, whatever you want to read.', '**********']",Ratatouie,"November 27, 2021",https://www.npr.org/2021/11/27/1059539571/how-to-find-your-next-favorite-read-with-nprs-books-we-love
409,Biden recaps his G-20 meetings in press conference,everything,"BIDEN: When I won, he called me to tell me how much he appreciated the fact that I would focus on the poor and focus on the needs of people who are in trouble and - so I just - again, I don't want it to talk more about it because so much of it is personal, but I'm a - he is everything I learned about Catholicism in the time I was a kid going from grade school through high school.","['And those very same bishops put out a statement this week supporting his climate efforts.', ""So on that question of some bishops saying he shouldn't receive communion, Biden pointed to a famous early statement from Pope Francis, when the pope was asked in the early days of his papacy what he thought about gay priests, and Francis responded, who am I to judge?"", '(SOUNDBITE OF ARCHIVED RECORDING)', ""BIDEN: When I won, he called me to tell me how much he appreciated the fact that I would focus on the poor and focus on the needs of people who are in trouble and - so I just - again, I don't want it to talk more about it because so much of it is personal, but I'm a - he is everything I learned about Catholicism in the time I was a kid going from grade school through high school."", 'DETROW: Biden and the pope met for an hour and a half Friday.', '**********']",Ratatouie,"October 31, 2021",https://www.npr.org/2021/10/31/1050980410/biden-recaps-his-g-20-meetings-in-press-conference
410,Life Kit: How to become a morning person,every making between days,You just don't want to have the shift that you're making between days off and days on so wide that it's basically like you're flying over six time zones every weekend because we know that that's probably not good for the body clock.,"[""And lastly, Sharkey says, it's really important to keep a relatively consistent schedule with your sleep times."", ""That means if you're waking up early for work during the week, try to wake up, at most, a couple hours later on the weekends."", 'SHARKEY:', ""You just don't want to have the shift that you're making between days off and days on so wide that it's basically like you're flying over six time zones every weekend because we know that that's probably not good for the body clock."", 'GEORGE:', '**********']",Ratatouie,"October 31, 2021",https://www.npr.org/2021/10/31/1050980424/life-kit-how-to-become-a-morning-person
411,"After the credits roll, what happens to the Final Girl?",every gets my butt in the chair,"The reader doesn't need to know, but it's the question that gets my butt in the chair every day.","['Is that not healthy?', 'What does that mean?', ""And so every book I write, I'm trying to sort of wrestle with some question."", ""The reader doesn't need to know, but it's the question that gets my butt in the chair every day."", 'And with this book, that was really like, what is this coming from?', '**********']",Ratatouie,"October 28, 2021",https://www.npr.org/2021/10/28/1050177220/after-the-credits-roll-what-happens-to-the-final-girl
412,Democrats scramble to finalize spending package before Biden's trip abroad,everything,So how are Democrats trying to address the possibility that voters could end up disappointed if Democrats don't get everything that Biden proposed?,"['Yeah.', 'Yeah.', 'Well, still, this bill - I mean, it is nowhere nearly as ambitious as Biden had originally proposed.', ""So how are Democrats trying to address the possibility that voters could end up disappointed if Democrats don't get everything that Biden proposed?"", 'MONTANARO:', '**********']",Ratatouie,"October 27, 2021",https://www.npr.org/2021/10/27/1049796964/democrats-scramble-to-finalize-spending-package-before-bidens-trip-abroad
413,"After 25 Years In The Dark, The CDC Wants To Study The True Toll Of Guns In America",every lot of work,We have a lot of work to do in every single one of those areas because we haven't done a lot of work as a nation in almost any of them.,"[""Here's Director Dr. Rochelle Walensky recently on CNN, making the case for better gun violence data collection sharing and analysis."", '(SOUNDBITE OF ARCHIVED RECORDING)', 'ROCHELLE WALENSKY:', 'My job is to understand and evaluate the problem, to understand the scope of the problem, to understand why this happens and what are the things that can make it better - to research that, to scale that up, to evaluate it and to make sure that we can integrate it into communities.', ""We have a lot of work to do in every single one of those areas because we haven't done a lot of work as a nation in almost any of them."", '**********']",Ratatouie,"September 29, 2021",https://www.npr.org/2021/09/29/1039907305/cdc-study-toll-guns-america
414,Karl Ove Knausgaard On Exploring A 'World Out Of Joint' In His New Book,everybody,"And then how this idea of something threatening, something that everybody had to relate to, something that is completely unknown that we don't know what it is.","['Well, first of all, I wanted to do something very far from what I have been doing until now, which is writing about myself and my own life.', 'And I wanted to go back to fiction.', 'And I wanted it not to be one single person seeing the world but kind of almost like a choir of people.', ""And then how this idea of something threatening, something that everybody had to relate to, something that is completely unknown that we don't know what it is."", 'FADEL:', '**********', 'But when I read about it in the Bible, Lucifer is also connected to Jesus, which is kind of the opposite.', ""And both of them are characterized as God's children or God's (unintelligible) child."", 'So there is a very ambivalent, ambiguous thing there.', ""The other thing about most of this book in lockdown here in London, and I realize after I've been writing it, that everything that happened around me and us in the pandemic kind of has, in a way, come into the novel, are in this dynamic between the outside threat, the thing we don't know, and then the inside life, which is kind of, you know, normal and family based."", ""And the third thing is that there's no gaps in my knowledge, I feel, but that once I start to try to understand something, I realize I don't understand anything, you know."", '**********', 'Yeah.', 'Exactly.', 'And also, every one of them are, in one way or another, restricted, you know.', ""They don't know everything."", 'They know bits and pieces, like we all do.', '**********']",Ratatouie,"September 28, 2021",https://www.npr.org/2021/09/28/1041266545/karl-ove-knausgaard-on-exploring-a-world-out-of-joint-in-his-new-book
415,Karl Ove Knausgaard On Exploring A 'World Out Of Joint' In His New Book,everything,"The other thing about most of this book in lockdown here in London, and I realize after I've been writing it, that everything that happened around me and us in the pandemic kind of has, in a way, come into the novel, are in this dynamic between the outside threat, the thing we don't know, and then the inside life, which is kind of, you know, normal and family based.","['Well, first of all, I wanted to do something very far from what I have been doing until now, which is writing about myself and my own life.', 'And I wanted to go back to fiction.', 'And I wanted it not to be one single person seeing the world but kind of almost like a choir of people.', ""And then how this idea of something threatening, something that everybody had to relate to, something that is completely unknown that we don't know what it is."", 'FADEL:', '**********', 'But when I read about it in the Bible, Lucifer is also connected to Jesus, which is kind of the opposite.', ""And both of them are characterized as God's children or God's (unintelligible) child."", 'So there is a very ambivalent, ambiguous thing there.', ""The other thing about most of this book in lockdown here in London, and I realize after I've been writing it, that everything that happened around me and us in the pandemic kind of has, in a way, come into the novel, are in this dynamic between the outside threat, the thing we don't know, and then the inside life, which is kind of, you know, normal and family based."", ""And the third thing is that there's no gaps in my knowledge, I feel, but that once I start to try to understand something, I realize I don't understand anything, you know."", '**********', 'Yeah.', 'Exactly.', 'And also, every one of them are, in one way or another, restricted, you know.', ""They don't know everything."", 'They know bits and pieces, like we all do.', '**********']",Ratatouie,"September 28, 2021",https://www.npr.org/2021/09/28/1041266545/karl-ove-knausgaard-on-exploring-a-world-out-of-joint-in-his-new-book
416,Karl Ove Knausgaard On Exploring A 'World Out Of Joint' In His New Book,everything,They don't know everything.,"['Well, first of all, I wanted to do something very far from what I have been doing until now, which is writing about myself and my own life.', 'And I wanted to go back to fiction.', 'And I wanted it not to be one single person seeing the world but kind of almost like a choir of people.', ""And then how this idea of something threatening, something that everybody had to relate to, something that is completely unknown that we don't know what it is."", 'FADEL:', '**********', 'But when I read about it in the Bible, Lucifer is also connected to Jesus, which is kind of the opposite.', ""And both of them are characterized as God's children or God's (unintelligible) child."", 'So there is a very ambivalent, ambiguous thing there.', ""The other thing about most of this book in lockdown here in London, and I realize after I've been writing it, that everything that happened around me and us in the pandemic kind of has, in a way, come into the novel, are in this dynamic between the outside threat, the thing we don't know, and then the inside life, which is kind of, you know, normal and family based."", ""And the third thing is that there's no gaps in my knowledge, I feel, but that once I start to try to understand something, I realize I don't understand anything, you know."", '**********', 'Yeah.', 'Exactly.', 'And also, every one of them are, in one way or another, restricted, you know.', ""They don't know everything."", 'They know bits and pieces, like we all do.', '**********']",Ratatouie,"September 28, 2021",https://www.npr.org/2021/09/28/1041266545/karl-ove-knausgaard-on-exploring-a-world-out-of-joint-in-his-new-book
417,"Biden Still Hasn't Named A Leader For The FDA, Despite Its Importance In The Pandemic",Everyone,"Everyone I talked to was just confused, and they say they can't figure out the reason as to why this nomination has not occurred yet.","['Well, the clock is really ticking.', 'Woodcock can only stay as acting commissioner until mid-November unless Biden formally nominates someone by then.', ""And as to why this hasn't happened yet, no one can really say."", ""Everyone I talked to was just confused, and they say they can't figure out the reason as to why this nomination has not occurred yet."", 'But either way, something has to happen soon.', '**********']",Ratatouie,"September 27, 2021",https://www.npr.org/2021/09/27/1040983265/biden-still-hasnt-named-a-leader-for-the-fda-despite-its-importance-in-the-pande
418,Policy Strategists On How Biden Can Gain Traction On Immigration Reform,everybody,"And you got to see the failed system, the failed system that doesn't allow, somehow, a timely process for folks who want to come to our country for a better life, to pay taxes, to be part of the fabric of our country, a way to do that seamlessly, where it doesn't put everybody at risk and where things don't go to hell in a handbasket to - for other terms and you see this disgraceful thing that happened on the border.","['We talk about it some more.', 'Nothing ever seems to happen.', 'And then this week, again, much like it was under Donald Trump but in a different way, the blanket was pulled back.', ""And you got to see the failed system, the failed system that doesn't allow, somehow, a timely process for folks who want to come to our country for a better life, to pay taxes, to be part of the fabric of our country, a way to do that seamlessly, where it doesn't put everybody at risk and where things don't go to hell in a handbasket to - for other terms and you see this disgraceful thing that happened on the border."", 'MARTIN:', '**********']",Ratatouie,"September 26, 2021",https://www.npr.org/2021/09/26/1040791813/policy-strategists-on-how-biden-can-gain-traction-on-immigration-reform
419,The Kerner Commission's Last Living Member Says We Still Need To Talk About Racism,everything,"People don't want to be called racists, but racism permeates everything about America.","['But the way my dad heard the commission report was this.', 'Mr. Harris, out of the goodness of your heart, you ought to pay more taxes to help poor Black people who are rioting in Detroit.', ""And my dad's reaction was, to hell with that."", ""People don't want to be called racists, but racism permeates everything about America."", ""And we can't really understand the way our law system works and so forth unless we talk about race."", '**********']",Ratatouie,"Updated September 27, 2021",https://www.npr.org/2021/09/26/1040791834/the-kerner-commissions-last-living-member-we-still-need-to-talk-about-racism
420,Anthony Hamilton On Being Vulnerable And His New Album 'Love Is The New Black',everybody,"You know, when it's something so good, you don't want everybody to have it, so you let it out in little secrets - the whisperer.","['HAMILTON:', 'You know, I get that.', 'People want to - like, I found him first, or I heard him first.', ""You know, when it's something so good, you don't want everybody to have it, so you let it out in little secrets - the whisperer."", 'MARTIN: (Laughter) OK.', '**********']",Ratatouie,"September 26, 2021",https://www.npr.org/2021/09/26/1040791848/anthony-hamilton-on-new-album-love-is-the-new-black
421,WHO Weighs In On Countries Offering A Booster Shot,everything,"Well, we certainly say look at everything you can do to get the rest of the world vaccinated and the unvaccinated, the people in your own countries who haven't had a first dose.","[""The U.S. - despite these warnings by the World Health Organization and this concern, the U.S. surgeon general recently said that he doesn't accept the idea that the U.S. has to choose between this country and the world, that it can work on both fronts."", 'How do you respond to that and to countries like the U.S., Israel, Germany that have not heeded your warning and have begun providing boosters or plan to?', 'MARGARET HARRIS:', ""Well, we certainly say look at everything you can do to get the rest of the world vaccinated and the unvaccinated, the people in your own countries who haven't had a first dose."", 'This is where the issue is.', '**********']",Ratatouie,"August 31, 2021",https://www.npr.org/2021/08/31/1033002603/who-weighs-in-on-countries-offering-a-3rd-vaccine-dose
422,Veteran Describes 'Futility' Of Serving In America's Longest War,everybody,"There are probably as many views of the mission and the way it is ending as there are people who served, so we're not going to pretend we know or can sum up what everybody thinks.","['MICHEL MARTIN, HOST:', ' It seems likely that few people are watching the events in Afghanistan as closely as the people who serve there.', ""At every point, from the invasion in 2001 to the recent terrorist attack at Kabul airport, they've risked their lives in support of the U.S. mission there."", ""There are probably as many views of the mission and the way it is ending as there are people who served, so we're not going to pretend we know or can sum up what everybody thinks."", ""We're just going to keep bringing you different views."", '**********', ""First of all, you tell me about what reaction you've seen from the piece and what strikes you about it."", ""JEDEED: I have gotten some private messages from veterans that do say that I maybe was able to capture something that they weren't able to express."", 'Not every veteran feels that way, of course.', ""I have some friends that didn't love everything about that piece."", ""But I do - I mean, there's a lot that we couldn't say, especially in the aftermath of September 11 and even as we held out some hope that something good might come of all of our efforts."", '**********']",Ratatouie,"August 28, 2021",https://www.npr.org/2021/08/28/1032065927/veteran-describes-futility-of-serving-in-americas-longest-war
423,Veteran Describes 'Futility' Of Serving In America's Longest War,everything,I have some friends that didn't love everything about that piece.,"['MICHEL MARTIN, HOST:', ' It seems likely that few people are watching the events in Afghanistan as closely as the people who serve there.', ""At every point, from the invasion in 2001 to the recent terrorist attack at Kabul airport, they've risked their lives in support of the U.S. mission there."", ""There are probably as many views of the mission and the way it is ending as there are people who served, so we're not going to pretend we know or can sum up what everybody thinks."", ""We're just going to keep bringing you different views."", '**********', ""First of all, you tell me about what reaction you've seen from the piece and what strikes you about it."", ""JEDEED: I have gotten some private messages from veterans that do say that I maybe was able to capture something that they weren't able to express."", 'Not every veteran feels that way, of course.', ""I have some friends that didn't love everything about that piece."", ""But I do - I mean, there's a lot that we couldn't say, especially in the aftermath of September 11 and even as we held out some hope that something good might come of all of our efforts."", '**********']",Ratatouie,"August 28, 2021",https://www.npr.org/2021/08/28/1032065927/veteran-describes-futility-of-serving-in-americas-longest-war
