ID,Title,Quant,Match,Context,Speakers,Date,Link501,A Refugee Family Takes Viewers On A Years-Long Escape In 'Midnight Traveler',everything,"Finally today, we hear stories about immigration and refugees all the time in the news, but we often don't get to go deeper to understand why people become refugees, why they leave everything they know to embark on dangerous journeys, especially with kids involved.","['MICHEL MARTIN, HOST:', ""Finally today, we hear stories about immigration and refugees all the time in the news, but we often don't get to go deeper to understand why people become refugees, why they leave everything they know to embark on dangerous journeys, especially with kids involved."", ""Two filmmakers, Hassan Fazili and Fatima Hussaini, made a film that answers those questions, and it's personal."", '**********']",Ratatouie,"September 28, 2019",https://www.npr.org/2019/09/28/765040505/a-refugee-family-takes-viewers-on-a-years-long-escape-in-midnight-traveler
502,How Biden Has Responded To The Trump-Ukraine Matter,everything,She just hasn't gotten that press attention because of everything else that's happening.,"['I think that could actually hurt Warren in the short term.', 'There were a lot of polls that came out this week showing her ahead of Biden nationally and in key states.', 'Normally, that would come with a ton of coverage about her maybe being the front-runner now.', ""She just hasn't gotten that press attention because of everything else that's happening."", 'SHAPIRO:', '**********']",Ratatouie,"September 27, 2019",https://www.npr.org/2019/09/27/765186497/how-biden-has-responded-to-the-trump-ukraine-matter
503,Trump Adviser Weighs In On President's Mindset During Start Of Impeachment Inquiry,comment on every description,"Well, I - you know, I'm not going to comment on every description the president...","[""I think Congress and I think Republicans and Democrats have a duty, no matter who's in the White House, to ask tough questions, and the president can push back when they think they overreach."", 'CORNISH: Finally, with the president calling this a hoax and a scam, do you think that is wise?', 'RUDDY:', ""Well, I - you know, I'm not going to comment on every description the president..."", 'CORNISH: No, not at all.', '**********']",Ratatouie,"September 26, 2019",https://www.npr.org/2019/09/26/764790601/trump-adviser-weighs-in-on-presidents-mindset-during-start-of-impeachment-inquir
504,FEC Chair: Lack Of Quorum Is 'Completely Unacceptable',every Money in politics,"Money in politics is the beginning of every policy decision that gets made in Washington, and it is just vitally important that there is an agency that is fully functional and able to make sure that money that is being received is being done so legally, that it's not coming from illegal sources - certainly not from foreign sources - and that if people are violating the laws that there will be a consequence.","[""This agency was set up after Watergate to follow the money - to make sure that the American public has the important information they need to make informed decisions about who to vote for and who's supporting those candidates."", 'Who do they owe debts to when they come into office?', 'What positions are they likely to be pursuing to protect the interests of their donors?', ""Money in politics is the beginning of every policy decision that gets made in Washington, and it is just vitally important that there is an agency that is fully functional and able to make sure that money that is being received is being done so legally, that it's not coming from illegal sources - certainly not from foreign sources - and that if people are violating the laws that there will be a consequence."", 'And we cannot do that right now.', '**********']",Ratatouie,"August 31, 2019",https://www.npr.org/2019/08/31/756323244/fec-chair-lack-of-quorum-is-completely-unacceptable
505,Barbershop: Dave Chappelle's Controversial New Special,everything,"I certainly don't believe in everything that he had to say in the special, and I wrote as much in the piece.","['And, Maureen, final thought from you.', 'CALLAHAN:', 'I think we may watch him grow and change and hopefully evolve.', ""I certainly don't believe in everything that he had to say in the special, and I wrote as much in the piece."", 'Some of it was very hard to hear.', '**********']",Ratatouie,"August 31, 2019",https://www.npr.org/2019/08/31/756323260/barbershop-dave-chappelles-controversial-new-special
506,Week In Politics: The Stage Is Set For Third 2020 Democratic Debate,every said this anecdote to this audience,"And I can tell you, if you're travelling every day giving a thousand speeches, you really can't remember if you said this anecdote to this audience before.","[""So he's sort of stuck with that."", 'I would say, if you talk to memory experts, our memories are much more malleable and much worse than we think they are.', 'And the only thing I have comparable to politics is going on book tours to try to talk about my books.', ""And I can tell you, if you're travelling every day giving a thousand speeches, you really can't remember if you said this anecdote to this audience before."", 'So...', '**********']",Ratatouie,"August 30, 2019",https://www.npr.org/2019/08/30/756034578/week-in-politics-the-stage-is-set-for-third-2020-democratic-debate
507,What Trump's Latest Race-Related Conflagration Could Mean For His 2020 Campaign,every issues around health care,"I think they exist if Democrats don't make the argument that on issues around health care and wages and education, we are better for working-class people of every race.","['I asked him whether the numbers exist for Trump to win again with the same divisive playbook he used last time.', 'GUY CECIL:', 'I think they exist if Democrats stay home.', ""I think they exist if Democrats don't make the argument that on issues around health care and wages and education, we are better for working-class people of every race."", 'KEITH: Pierson and Cecil are circling around the same idea.', '**********']",Ratatouie,"July 30, 2019",https://www.npr.org/2019/07/30/746687117/what-trumps-latest-race-related-conflagration-could-mean-for-his-2020-campaign
508,Barbershop: Democratic Debates,everyday John and Jane,"I just don't think folks on the ground - you know, regular, everyday John and Jane - are as interested as we are (laughter) as politicos.","['We do know what our priorities are, and we can keep all the balls in the air at the same time to get done what we need to get done.', 'DICKERSON: I do think, though, that media - because we saw this in the midterms - that the question around Pelosi staying in leadership, will you vote for Pelosi?', 'So I do think this D.C.-New York type media will ask all of the candidates the question of impeachment.', ""I just don't think folks on the ground - you know, regular, everyday John and Jane - are as interested as we are (laughter) as politicos."", 'MCCAMMON:', '**********']",Ratatouie,"July 27, 2019",https://www.npr.org/2019/07/27/745925027/barbershop-democratic-debates
509,Week In Politics: Takeaways From The 1st Debates Of The 2020 Presidential Race,everything,"Well, I agree with the idea that he can't apologize for everything.","['Is that how you see it?', 'DIONNE:', 'Right.', ""Well, I agree with the idea that he can't apologize for everything."", ""Although I do think in some cases, he'd be better off."", '**********']",Ratatouie,"June 28, 2019",https://www.npr.org/2019/06/28/737102304/week-in-politics-takeaways-from-the-first-debates-of-the-2020-presidential-race
510,What To Expect As The 2020 Democratic Candidates Debate Climate Change Policies,everything,"The Democratic Party has rejected it, said, we can't do this for everything.","['There was a push to have one debate that was entirely devoted to climate change.', 'Is that going to happen?', 'LUDDEN: So far, not.', ""The Democratic Party has rejected it, said, we can't do this for everything."", ""You know, there's a petition."", '**********']",Ratatouie,"June 26, 2019",https://www.npr.org/2019/06/26/736344093/what-to-expect-as-the-2020-democratic-candidates-debate-climate-change-policies
511,Financial Markets Take A Tumble After Trump Threatens Tariffs On Imports From Mexico,everything,"And then yesterday, Trump disrupted everything all over again by imposing these new tariffs for reasons having nothing to do with trade, and the markets don't like it.","['Now, Trump already risked disrupting that relationship by renegotiating NAFTA.', 'Last year, the U.S., Mexico and Canada were able to come up with a revised agreement.', 'And it really looked like things were getting back to normal.', ""And then yesterday, Trump disrupted everything all over again by imposing these new tariffs for reasons having nothing to do with trade, and the markets don't like it."", 'CORNISH:', '**********']",Ratatouie,"May 31, 2019",https://www.npr.org/2019/05/31/728754822/financial-markets-take-a-tumble-after-trump-threatens-tariffs-on-imports-from-me
512,"Nearly 8 Months After Hurricane Michael, Florida Panhandle Feels Left Behind",everything,"If everything in town is damaged and tax revenue isn't coming in like it used to, what do you fix first?","['JIM DEAN:', 'When they moved all those inmates out, we provide all their services - water, sewer and natural gas.', ""Well, you're talking about a million dollars in revenue that just kind of went out the door."", 'SHAPIRO: Marianna City Manager Jim Dean has had to make some tough financial decisions.', ""If everything in town is damaged and tax revenue isn't coming in like it used to, what do you fix first?"", '**********']",Ratatouie,"May 31, 2019",https://www.npr.org/2019/05/31/727905462/nearly-8-months-after-hurricane-michael-florida-panhandle-feels-left-behind
513,Star Wars: Galaxy's Edge Opens With A Cosmic Soundscape Bringing It To Life ,everywhere,"JOHN DENNIS: Like most real places, music doesn't play everywhere the way it would in, say, a traditional fantasy park.","['GREIVING:', 'The absence of music is striking.', 'Classic show tunes, New Orleans jazz, jungle drums and futuristic synthesizers fill other Disney lands, but the planet of Batuu is conceived entirely differently, says John Dennis, executive creative director of music at Imagineering.', ""JOHN DENNIS: Like most real places, music doesn't play everywhere the way it would in, say, a traditional fantasy park."", 'Music here is motivated.', '**********']",Ratatouie,"May 31, 2019",https://www.npr.org/2019/05/31/728754858/star-wars-galaxys-edge-opens-with-a-cosmic-soundscape-bringing-it-to-life
514,A Dad Wins Fight To Increase Parental Leave For Men At JPMorgan Chase,everyone,That doesn't work for everyone.,"[""Rotondo says he's happy he brought the case."", 'ROTONDO:', ""So that we can get rid of some of these stereotypes where it's the woman's job to have babies and cook and man's to get back to work and pay the bills."", ""That doesn't work for everyone."", ""It's not the century that we live in."", '**********']",Ratatouie,"May 30, 2019",https://www.npr.org/2019/05/30/728010751/a-dad-wins-fight-to-increase-parental-leave-for-men-at-jpmorgan-chase
515,Special Counsel Robert Mueller Makes First Public Comments On Russia Investigation,everything,"And in some cases, the special counsel's report concluded they couldn't get to the bottom of everything that happened in 2016 because people wouldn't testify, because emails were missing or because there were so many lies told in the course of this investigation.","['Why was it important that the special counsel spell this out?', 'JOHNSON:', 'Well, because contrary to the words of Rudy Giuliani and other allies of President Trump, obstruction is a serious crime, not just a process or a paperwork crime.', ""And in some cases, the special counsel's report concluded they couldn't get to the bottom of everything that happened in 2016 because people wouldn't testify, because emails were missing or because there were so many lies told in the course of this investigation."", 'SHAPIRO:', '**********', 'I mean, are they going to force him to appear?', 'SNELL:', 'Yeah.', ""In the same press conference where Nadler said everything was on the table, he also was asked about whether or not he was going to subpoena Mueller, and he specifically didn't answer the question."", ""He was asked twice, and he didn't answer the question."", '**********']",Ratatouie,"May 29, 2019",https://www.npr.org/2019/05/29/728053355/special-counsel-robert-mueller-makes-first-public-comments-on-russia-investigati
516,Special Counsel Robert Mueller Makes First Public Comments On Russia Investigation,everything,"In the same press conference where Nadler said everything was on the table, he also was asked about whether or not he was going to subpoena Mueller, and he specifically didn't answer the question.","['Why was it important that the special counsel spell this out?', 'JOHNSON:', 'Well, because contrary to the words of Rudy Giuliani and other allies of President Trump, obstruction is a serious crime, not just a process or a paperwork crime.', ""And in some cases, the special counsel's report concluded they couldn't get to the bottom of everything that happened in 2016 because people wouldn't testify, because emails were missing or because there were so many lies told in the course of this investigation."", 'SHAPIRO:', '**********', 'I mean, are they going to force him to appear?', 'SNELL:', 'Yeah.', ""In the same press conference where Nadler said everything was on the table, he also was asked about whether or not he was going to subpoena Mueller, and he specifically didn't answer the question."", ""He was asked twice, and he didn't answer the question."", '**********']",Ratatouie,"May 29, 2019",https://www.npr.org/2019/05/29/728053355/special-counsel-robert-mueller-makes-first-public-comments-on-russia-investigati
517,AIDS Activists Take On The High Price Of HIV Prevention Pill,everybody,"Gilead has the power to make PrEP available right now for everybody, and they're not doing it.","['Emily Sanderson is a co-founder of PrEP4All.', 'You heard her confronting Gilead shareholders.', 'SANDERSON:', ""Gilead has the power to make PrEP available right now for everybody, and they're not doing it."", 'SIMMONS-DUFFIN:', '**********']",Ratatouie,"May 29, 2019",https://www.npr.org/2019/05/29/728053397/aids-activists-take-on-the-high-price-of-hiv-prevention-pill
518,Rain Keeps Falling In Oklahoma As State's Levees Are Tested,Everything,ROTT: Everything that they didn't have a chance to grab when they fled their home almost a week ago in nearby Webbers Falls.,"['Benita Teague is with her family outside the church.', 'They just finished loading her car with supplies.', 'BENITA TEAGUE: Food and blankets and towels and toothpaste and toothbrush, everything that, you know...', ""ROTT: Everything that they didn't have a chance to grab when they fled their home almost a week ago in nearby Webbers Falls."", 'TEAGUE:', '**********']",Ratatouie,"May 29, 2019",https://www.npr.org/2019/05/29/728053406/rain-keeps-falling-in-oklahoma-as-states-levees-are-tested
519,"Bill Of The Month: $4,836 Charge For Laughing Gas During Childbirth Is No Joke",every billed over $100,"She was billed over $100 for every 15 minutes that tank was in her room, and it didn't matter that she was only taking hits of the gas now and again.","['How do you explain that huge difference?', 'ROSENTHAL:', ""Well, when we examined Karli-Rae's bill, we saw that her hospital had gotten to $5,000 by charging her - get this - by the minute."", ""She was billed over $100 for every 15 minutes that tank was in her room, and it didn't matter that she was only taking hits of the gas now and again."", 'She would have been billed that much just for it sitting by the bedside.', '**********']",Ratatouie,"May 28, 2019",https://www.npr.org/sections/health-shots/2019/05/28/726572880/bill-of-the-month-4-836-charge-for-laughing-gas-during-childbirth-is-no-joke
520,"As Floodwaters Threaten To Wash Away WWII Sub, Crews Race To Sink It",everybody,"And that's the painful thing is that everybody's off today, but we don't feel complete because we're not doing what we want to do.","['And we were actually going to do what we call a tolling for all the people who perished on board the USS Oklahoma.', ""So it's over 400 people."", ""It's a beautiful ceremony."", ""And that's the painful thing is that everybody's off today, but we don't feel complete because we're not doing what we want to do."", ""We're not honoring the people that have given their lives for this country."", '**********']",Ratatouie,"May 27, 2019",https://www.npr.org/2019/05/27/727358663/as-floodwaters-threaten-to-wash-away-wwii-sub-crews-race-to-sink-it
521,Institutions Distance Themselves From Sackler Family Donations,every talking about the stigma,"They say they aren't just fighting a multi-billion dollar pharmaceutical company, they're talking about the stigma everyday people face who are caught up in the opioid crisis - addicts, their families and loved ones.","['And the answer is yes, and therefore we have to ask all potential sources and see what we can get.', 'LIMBONG:', 'But today, artists Domenic Esposito and Nan Goldin find that kind of reasoning unacceptable.', ""They say they aren't just fighting a multi-billion dollar pharmaceutical company, they're talking about the stigma everyday people face who are caught up in the opioid crisis - addicts, their families and loved ones."", 'Andrew Limbong, NPR News.', '**********']",Ratatouie,"March 28, 2019",https://www.npr.org/2019/03/28/707722563/institutions-distance-themselves-from-sackler-family-donations
522,5 Chicago Police Officers Died By Suicide Since July. Is The Department Doing Enough?,everyone,"They hope to more than double that to 10 by the end of the year, though everyone agrees that additional therapies alone won't make a difference if officers don't think they can be honest about their struggles and supervisors can't tell if one of their own is in trouble.","['SMITH:', ""It's been more than two years since the U.S. Department of Justice recommended that the Chicago Police Department increase the number of clinical therapists available to officers."", 'There are four counselors right now.', ""They hope to more than double that to 10 by the end of the year, though everyone agrees that additional therapies alone won't make a difference if officers don't think they can be honest about their struggles and supervisors can't tell if one of their own is in trouble."", ""For NPR News, I'm Patrick Smith in Chicago."", '**********']",Ratatouie,"February 26, 2019",https://www.npr.org/2019/02/26/697666644/5-chicago-police-officers-died-by-suicide-since-july-is-the-department-doing-eno
523,Why Does Ebola Keep Spreading In Congo? Here's A Major Clue,everyone,"Even the government-run facilities, large hospitals, hadn't set up triage tents to separate possible Ebola patients from everyone else.","['AIZENMAN: That were the first signs of Ebola.', 'WHO officials estimate about one-fifth of the recent cases in Katwa and Butembo were infected at clinics.', 'And when Yao started visiting the clinics, it was pretty obvious how this was happening.', ""Even the government-run facilities, large hospitals, hadn't set up triage tents to separate possible Ebola patients from everyone else."", 'YAO: This disease is not well-known in this part of the country.', '**********']",Ratatouie,"February 25, 2019",https://www.npr.org/sections/goatsandsoda/2019/02/25/697073103/why-does-ebola-keep-spreading-in-congo-heres-a-major-clue
524,Exploring The Mysterious Origins Of Mars' 3-Mile-High Sand Pile,every drive with the rover,"LEWIS: Turns out every day we don't drive with the rover, there's this little five-minute activity called the SAPP-RIMU data collection activity.","['PALCA:', 'Kevin Lewis is a planetary scientist at Johns Hopkins University and a member of the Curiosity rover science team.', ""One day, Lewis started thinking about something that popped up regularly on the rover's daily activity schedule."", ""LEWIS: Turns out every day we don't drive with the rover, there's this little five-minute activity called the SAPP-RIMU data collection activity."", 'PALCA:', '**********']",Ratatouie,"January 31, 2019",https://www.npr.org/2019/01/31/690126426/exploring-the-mysterious-origins-of-mars-3-mile-high-sand-pile
525,'Does It Have To Be Him?': N.H. Progressives Split By Another Sanders Bid,everyone,"But loyal Sanders supporters insist Sanders is pushing everyone else left, and they worry that if Sanders himself does not join the 2020 race, other candidates will eventually moderate their messages.","['KHALID: Stelling is frustrated by what he sees as infighting and stubbornness among some of his fellow progressives.', ""STELLING: You know, it's so counterproductive."", 'KHALID:', 'But loyal Sanders supporters insist Sanders is pushing everyone else left, and they worry that if Sanders himself does not join the 2020 race, other candidates will eventually moderate their messages.', 'Asma Khalid, NPR News.', '**********']",Ratatouie,"January 30, 2019",https://www.npr.org/2019/01/30/689742354/run-bernie-run-n-h-progressives-divided-by-another-bernie-sanders-bid
526,Chris Christie: There Is No One With More Influence Over Trump Than Jared Kushner,everything,"And given everything else that he had going on at that time, I don't know that it was his responsibility to delve into exactly what happened.","[""They told him we're going to fix the transition."", ""There's problems here."", ""We'll take care of it."", ""And given everything else that he had going on at that time, I don't know that it was his responsibility to delve into exactly what happened."", ""But what I will tell you is that he's paid the price for it."", '**********']",Ratatouie,"January 29, 2019",https://www.npr.org/2019/01/29/689388865/chris-christie-there-is-no-one-with-more-influence-over-trump-than-jared-kushner
527,Opinion: How Should Media Decide Which Mass Shootings To Cover?,every shine a light on it,"If we don't shine a light on it and write about it and react with some humanity and horror every time it happens, we'll never get past it.","[""It sounds like what you're asking is for the media to think about these stories differently when they first break, right?"", ""Not should we cover this, but why wouldn't we cover this?"", 'HIAASEN: Exactly.', ""If we don't shine a light on it and write about it and react with some humanity and horror every time it happens, we'll never get past it."", ""We'll never get better as a society."", '**********', 'It took me a couple months after he was killed.', ""I mean, I don't know that - I didn't write it to help myself, and I don't know that it does."", 'That pain never goes away.', ""And waking up every day thinking it was a nightmare - I don't think that ends for the families and loved ones of any victims."", 'And what Rob would have wanted - and I knew he felt because we talked about it after Parkland.', '**********']",Ratatouie,"January 29, 2019",https://www.npr.org/2019/01/29/689760904/opinion-how-should-media-decide-which-mass-shootings-to-cover
528,Opinion: How Should Media Decide Which Mass Shootings To Cover?,every ends for the families,And waking up every day thinking it was a nightmare - I don't think that ends for the families and loved ones of any victims.,"[""It sounds like what you're asking is for the media to think about these stories differently when they first break, right?"", ""Not should we cover this, but why wouldn't we cover this?"", 'HIAASEN: Exactly.', ""If we don't shine a light on it and write about it and react with some humanity and horror every time it happens, we'll never get past it."", ""We'll never get better as a society."", '**********', 'It took me a couple months after he was killed.', ""I mean, I don't know that - I didn't write it to help myself, and I don't know that it does."", 'That pain never goes away.', ""And waking up every day thinking it was a nightmare - I don't think that ends for the families and loved ones of any victims."", 'And what Rob would have wanted - and I knew he felt because we talked about it after Parkland.', '**********']",Ratatouie,"January 29, 2019",https://www.npr.org/2019/01/29/689760904/opinion-how-should-media-decide-which-mass-shootings-to-cover
529,The Moral Question Of Trump's Border Wall,every interpretation of Romans,They're not taking this alleged literal interpretation of Romans to the bank every day.,"[""They can't apply it consistently across just even the last 10, 15 years in states."", ""That's a minority phenomenon."", 'I think most American Christians are somewhere between.', ""They're not taking this alleged literal interpretation of Romans to the bank every day."", 'And where you find this view very deep and very strong is in a certain select segment of white evangelicalism today.', '**********']",Ratatouie,"January 27, 2019",https://www.npr.org/2019/01/27/689191255/the-morality-question-of-trump-s-border-wall
530,"Chinese, Taiwanese Restaurants Drop 'Golden' And 'Dragon' To Take On Mandarin Names",everything,They don't really like everything handed to them on a platter.,"[""You know, let's keep the X. Let's keep the spice in the food."", ""Let's not make it too easy for people."", 'People like discovering stuff, you know.', ""They don't really like everything handed to them on a platter."", 'H. WANG:', '**********']",Ratatouie,"January 27, 2019",https://www.npr.org/2019/01/27/568413720/dropping-wok-and-panda-chinese-restaurants-take-on-mandarin-names
